{
  "format": "mooyu.curriculum-knowledge-map",
  "schemaVersion": 1,
  "id": "cn-upper-secondary-2017-2020",
  "title": {
    "zh-CN": "中国普通高中课程知识地图",
    "en": "China General Upper Secondary Curriculum Knowledge Map"
  },
  "jurisdiction": "CN",
  "educationStage": "upper-secondary",
  "curriculumVersion": "2017-2020",
  "authorities": [
    {
      "id": "moe.cn-hs-2017-2020-bundle",
      "title": {
        "zh-CN": "普通高中课程方案和语文等学科课程标准（2017年版2020年修订）",
        "en": "General Upper Secondary Curriculum Plan and Subject Standards (2017 Edition, 2020 Revision)"
      },
      "issuer": "中华人民共和国教育部",
      "documentKind": "curriculum-standard",
      "publishedAt": "2020-05-11",
      "sourceUrl": "https://www.moe.gov.cn/srcsite/A26/s8001/202006/t20200603_462199.html",
      "artifactUrl": "https://www.moe.gov.cn/srcsite/A26/s8001/202006/W020200603315372317586.zip",
      "artifactSha256": "30204dfd2357c6d6f3bd66e55538f1fbb62a952459aff9c0293e3e2d608d004f"
    }
  ],
  "subjects": [
    { "id": "chinese", "title": { "zh-CN": "语文", "en": "Chinese Language and Literature" }, "authorityId": "moe.cn-hs-2017-2020-bundle", "standardNumber": 2, "rootNodeId": "cn-hs.chinese", "curriculumLevels": ["required", "selective-required", "elective"], "catalogStatus": "source-verified" },
    { "id": "mathematics", "title": { "zh-CN": "数学", "en": "Mathematics" }, "authorityId": "moe.cn-hs-2017-2020-bundle", "standardNumber": 3, "rootNodeId": "cn-hs.mathematics", "curriculumLevels": ["required", "selective-required", "elective"], "catalogStatus": "atomic-draft" },
    { "id": "english", "title": { "zh-CN": "英语", "en": "English" }, "authorityId": "moe.cn-hs-2017-2020-bundle", "standardNumber": 4, "rootNodeId": "cn-hs.english", "curriculumLevels": ["required", "selective-required", "elective"], "catalogStatus": "source-verified" },
    { "id": "ideological-political", "title": { "zh-CN": "思想政治", "en": "Ideology and Politics" }, "authorityId": "moe.cn-hs-2017-2020-bundle", "standardNumber": 5, "rootNodeId": "cn-hs.ideological-political", "curriculumLevels": ["required", "selective-required", "elective"], "catalogStatus": "source-verified" },
    { "id": "history", "title": { "zh-CN": "历史", "en": "History" }, "authorityId": "moe.cn-hs-2017-2020-bundle", "standardNumber": 6, "rootNodeId": "cn-hs.history", "curriculumLevels": ["required", "selective-required", "elective"], "catalogStatus": "source-verified" },
    { "id": "geography", "title": { "zh-CN": "地理", "en": "Geography" }, "authorityId": "moe.cn-hs-2017-2020-bundle", "standardNumber": 7, "rootNodeId": "cn-hs.geography", "curriculumLevels": ["required", "selective-required", "elective"], "catalogStatus": "source-verified" },
    { "id": "physics", "title": { "zh-CN": "物理", "en": "Physics" }, "authorityId": "moe.cn-hs-2017-2020-bundle", "standardNumber": 8, "rootNodeId": "cn-hs.physics", "curriculumLevels": ["required", "selective-required", "elective"], "catalogStatus": "atomic-draft" },
    { "id": "chemistry", "title": { "zh-CN": "化学", "en": "Chemistry" }, "authorityId": "moe.cn-hs-2017-2020-bundle", "standardNumber": 9, "rootNodeId": "cn-hs.chemistry", "curriculumLevels": ["required", "selective-required", "elective"], "catalogStatus": "atomic-draft" },
    { "id": "biology", "title": { "zh-CN": "生物学", "en": "Biology" }, "authorityId": "moe.cn-hs-2017-2020-bundle", "standardNumber": 10, "rootNodeId": "cn-hs.biology", "curriculumLevels": ["required", "selective-required", "elective"], "catalogStatus": "source-verified" },
    { "id": "information-technology", "title": { "zh-CN": "信息技术", "en": "Information Technology" }, "authorityId": "moe.cn-hs-2017-2020-bundle", "standardNumber": 11, "rootNodeId": "cn-hs.information-technology", "curriculumLevels": ["required", "selective-required", "elective"], "catalogStatus": "source-verified" },
    { "id": "general-technology", "title": { "zh-CN": "通用技术", "en": "General Technology" }, "authorityId": "moe.cn-hs-2017-2020-bundle", "standardNumber": 12, "rootNodeId": "cn-hs.general-technology", "curriculumLevels": ["required", "selective-required", "elective"], "catalogStatus": "source-verified" },
    { "id": "arts", "title": { "zh-CN": "艺术", "en": "Arts" }, "authorityId": "moe.cn-hs-2017-2020-bundle", "standardNumber": 13, "rootNodeId": "cn-hs.arts", "curriculumLevels": ["required", "selective-required", "elective"], "catalogStatus": "source-verified" },
    { "id": "music", "title": { "zh-CN": "音乐", "en": "Music" }, "authorityId": "moe.cn-hs-2017-2020-bundle", "standardNumber": 14, "rootNodeId": "cn-hs.music", "curriculumLevels": ["required", "selective-required", "elective"], "catalogStatus": "source-verified" },
    { "id": "fine-arts", "title": { "zh-CN": "美术", "en": "Fine Arts" }, "authorityId": "moe.cn-hs-2017-2020-bundle", "standardNumber": 15, "rootNodeId": "cn-hs.fine-arts", "curriculumLevels": ["required", "selective-required", "elective"], "catalogStatus": "source-verified" },
    { "id": "physical-education-health", "title": { "zh-CN": "体育与健康", "en": "Physical Education and Health" }, "authorityId": "moe.cn-hs-2017-2020-bundle", "standardNumber": 16, "rootNodeId": "cn-hs.physical-education-health", "curriculumLevels": ["required", "selective-required", "elective"], "catalogStatus": "source-verified" },
    { "id": "japanese", "title": { "zh-CN": "日语", "en": "Japanese" }, "authorityId": "moe.cn-hs-2017-2020-bundle", "standardNumber": 17, "rootNodeId": "cn-hs.japanese", "curriculumLevels": ["required", "selective-required", "elective"], "catalogStatus": "source-verified" },
    { "id": "russian", "title": { "zh-CN": "俄语", "en": "Russian" }, "authorityId": "moe.cn-hs-2017-2020-bundle", "standardNumber": 18, "rootNodeId": "cn-hs.russian", "curriculumLevels": ["required", "selective-required", "elective"], "catalogStatus": "source-verified" },
    { "id": "german", "title": { "zh-CN": "德语", "en": "German" }, "authorityId": "moe.cn-hs-2017-2020-bundle", "standardNumber": 19, "rootNodeId": "cn-hs.german", "curriculumLevels": ["required", "selective-required", "elective"], "catalogStatus": "source-verified" },
    { "id": "french", "title": { "zh-CN": "法语", "en": "French" }, "authorityId": "moe.cn-hs-2017-2020-bundle", "standardNumber": 20, "rootNodeId": "cn-hs.french", "curriculumLevels": ["required", "selective-required", "elective"], "catalogStatus": "source-verified" },
    { "id": "spanish", "title": { "zh-CN": "西班牙语", "en": "Spanish" }, "authorityId": "moe.cn-hs-2017-2020-bundle", "standardNumber": 21, "rootNodeId": "cn-hs.spanish", "curriculumLevels": ["required", "selective-required", "elective"], "catalogStatus": "source-verified" }
  ],
  "fragments": ["subjects/mathematics.json", "subjects/mathematics-required-functions.json", "subjects/mathematics-required-geometry-data-modeling.json", "subjects/mathematics-selective-required.json", "subjects/mathematics-electives.json", "subjects/physics-required.json", "subjects/physics-selective-required.json", "subjects/physics-required-experiments.json", "subjects/physics-electives.json", "subjects/chemistry-required.json", "subjects/chemistry-required-experiments.json", "subjects/chemistry-selective-required.json", "subjects/chemistry-electives.json", "subjects/mathematics-textbook-mappings.json", "subjects/physics-textbook-mappings.json", "subjects/chemistry-textbook-mappings.json"],
  "nodes": [
    { "id": "cn-hs.chinese", "subjectId": "chinese", "type": "subject-root", "title": { "zh-CN": "普通高中语文", "en": "Upper Secondary Chinese" }, "curriculumLevels": ["required", "selective-required", "elective"], "standardRefs": [{ "authorityId": "moe.cn-hs-2017-2020-bundle", "locator": "PDF 2：普通高中语文课程标准", "scope": "verbatim" }], "representations": ["verbal"], "observableVariables": [], "interactionCandidates": [], "review": { "status": "source-checked", "sourceChecked": true, "subjectChecked": false } },
    { "id": "cn-hs.mathematics", "subjectId": "mathematics", "type": "subject-root", "title": { "zh-CN": "普通高中数学", "en": "Upper Secondary Mathematics" }, "curriculumLevels": ["required", "selective-required", "elective"], "standardRefs": [{ "authorityId": "moe.cn-hs-2017-2020-bundle", "locator": "PDF 3：普通高中数学课程标准", "scope": "verbatim" }], "representations": ["verbal", "symbolic", "graph", "table", "diagram"], "observableVariables": [], "interactionCandidates": [], "review": { "status": "source-checked", "sourceChecked": true, "subjectChecked": false } },
    { "id": "cn-hs.english", "subjectId": "english", "type": "subject-root", "title": { "zh-CN": "普通高中英语", "en": "Upper Secondary English" }, "curriculumLevels": ["required", "selective-required", "elective"], "standardRefs": [{ "authorityId": "moe.cn-hs-2017-2020-bundle", "locator": "PDF 4：普通高中英语课程标准", "scope": "verbatim" }], "representations": ["verbal", "audio", "visual"], "observableVariables": [], "interactionCandidates": [], "review": { "status": "source-checked", "sourceChecked": true, "subjectChecked": false } },
    { "id": "cn-hs.ideological-political", "subjectId": "ideological-political", "type": "subject-root", "title": { "zh-CN": "普通高中思想政治", "en": "Upper Secondary Ideology and Politics" }, "curriculumLevels": ["required", "selective-required", "elective"], "standardRefs": [{ "authorityId": "moe.cn-hs-2017-2020-bundle", "locator": "PDF 5：普通高中思想政治课程标准", "scope": "verbatim" }], "representations": ["verbal", "diagram"], "observableVariables": [], "interactionCandidates": [], "review": { "status": "source-checked", "sourceChecked": true, "subjectChecked": false } },